{
  "$schema": "https://json-schema.org/draft/2020-12/schema",
  "$id": "https://hotel.test/contracts/events/envelope.v1.schema.json",
  "title": "Envelope de evento Kafka v1",
  "description": "Envelope común de los eventos de dominio publicados en Kafka (identity.persona.v1, hotel.sede.v1, hotel.habitacion.v1, reception.recepcion.v1, inventory.stock.v1, inventory.movimiento.v1, sales.venta.v1). Los esquemas de cada tipo de evento lo referencian con allOf y restringen type y payload. Kafka key = aggregateId salvo clave compuesta indicada; headers content-type=application/json, schema-version=1 y correlation-id.",
  "type": "object",
  "additionalProperties": false,
  "required": [
    "eventId",
    "type",
    "schemaVersion",
    "aggregateType",
    "aggregateId",
    "aggregateVersion",
    "idHotel",
    "occurredAt",
    "correlationId",
    "payload"
  ],
  "properties": {
    "eventId": {
      "type": "string",
      "format": "uuid",
      "description": "Identificador único del evento (UUID). Un reenvío manual desde DLT conserva el mismo eventId y la misma key."
    },
    "type": {
      "type": "string",
      "minLength": 1,
      "description": "Tipo de evento en PascalCase; p. ej. CheckInRegistrado, SalidaRegistrada, ProductoStockSnapshot."
    },
    "schemaVersion": {
      "const": 1,
      "description": "Versión del esquema del mensaje. Esta carpeta cubre la v1 de todos los tipos."
    },
    "aggregateType": {
      "type": "string",
      "minLength": 1,
      "description": "Tipo de agregado: persona, sede, habitacion, habitacion-ocupacion, producto-sede, movimiento-stock o venta."
    },
    "aggregateId": {
      "type": "string",
      "minLength": 1,
      "description": "Identificador del agregado serializado como texto (= Kafka key). En inventory.stock.v1 la clave es compuesta: idHotel:idProducto."
    },
    "aggregateVersion": {
      "type": "integer",
      "minimum": 0,
      "description": "Versión del agregado al emitir el evento; en reception.recepcion.v1 corresponde a roomVersion."
    },
    "idHotel": {
      "type": [
        "integer",
        "null"
      ],
      "minimum": 1,
      "description": "Sede del hecho (entero positivo) o null para hechos globales (PersonaSnapshot global)."
    },
    "occurredAt": {
      "type": "string",
      "format": "date-time",
      "description": "Fecha y hora del hecho en UTC (sufijo Z), p. ej. 2026-10-04T15:00:00Z."
    },
    "correlationId": {
      "type": "string",
      "format": "uuid",
      "description": "Identificador de correlación extremo a extremo; se propaga en el header correlation-id y se conserva en los reintentos."
    },
    "payload": {
      "type": "object",
      "description": "Cuerpo del evento. Cada tipo concreto lo restringe con additionalProperties:false, tipos y enums en su propio esquema."
    }
  },
  "examples": [
    {
      "eventId": "11111111-1111-4111-8111-111111111111",
      "type": "CheckInRegistrado",
      "schemaVersion": 1,
      "aggregateType": "habitacion-ocupacion",
      "aggregateId": "101",
      "aggregateVersion": 1,
      "idHotel": 1,
      "occurredAt": "2026-10-04T15:00:00Z",
      "correlationId": "22222222-2222-4222-8222-222222222222",
      "payload": {
        "idRecepcion": 1001,
        "idHabitacion": 101,
        "idCliente": 100,
        "estadoEstadia": "ACTIVA"
      }
    }
  ]
}
