{
  "eventId": "aaaaaaaa-0000-4000-8000-000000000003",
  "type": "HabitacionLista",
  "schemaVersion": 1,
  "aggregateType": "habitacion",
  "aggregateId": "101",
  "aggregateVersion": 8,
  "idHotel": 1,
  "occurredAt": "2026-10-20T12:05:00Z",
  "correlationId": "aaaaaaaa-0000-4000-8000-000000000004",
  "payload": {
    "idHabitacion": 101,
    "idHotel": 1,
    "numero": "101",
    "idCategoria": 1,
    "categoriaNombre": "Individual",
    "pisoNombre": "Primer piso",
    "precio": 70.00,
    "estado": true,
    "estadoFisico": "LISTA",
    "version": 8,
    "cleaningCycleId": "aaaaaaaa-0000-4000-8000-000000000005",
    "cleaningRoomVersion": 1,
    "blockId": null
  }
}
